,tweet,parse
1544,"Culpan al gato Gatell, llamándolo #DrMuerte, y pues no, no es él el único culpable, ahí están los fiesteros, haciendo reuniones, los que salen en familia a plazas, los que no usan cubrebocas, así que no culpen a alguien, somos todos los culpables. #EsDeUrgidos no aguantarsela.","Culpan al gato Gatell, llamándolo #DrMuerte, y pues no, no es él el único culpable, ahí están los fiesteros, haciendo reuniones, los que salen en familia a plazas, los que no usan cubrebocas, así que no culpen a alguien, somos todos los culpables. #EsDeUrgidos no aguantarsela."
1545,Cien mil CHATPM Gatell!,Cien mil CHATPM Gatell!
1546,"@macxtter @CiroGomezL @HLGatell El responsable de establecer la norma son los López, Obrador y Gatell, si ellos son responsables además de la gente que no acata las medidas necesarias como bien dices","@macxtter @CiroGomezL @HLGatell El responsable de establecer la norma son los López, Obrador y Gatell, si ellos son responsables además de la gente que no acata las medidas necesarias como bien dices"
1547,🚨 #ÚLTIMAHORA | AMLO: López-Gatell ha hecho un trabajo excepcional en estrategia antiCOVID ,🚨 #ÚLTIMAHORA | AMLO: López-Gatell ha hecho un trabajo excepcional en estrategia antiCOVID 
1548,"@CiroGomezL @HLGatell Gatell no entiende que NO entiende, solo parece entender lo que a López le gusta que entienda... ","@CiroGomezL @HLGatell Gatell no entiende que NO entiende, solo parece entender lo que a López le gusta que entienda... "
1549,🚨 #ÚLTIMAHORA | López-Gatell ha hecho un trabajo excepcional en estrategia antiCOVID: @lopezobrador_ ,🚨 #ÚLTIMAHORA | López-Gatell ha hecho un trabajo excepcional en estrategia antiCOVID: @lopezobrador_ 
1550,"@jgnaredo Para mi que ya contrataron en todo el mundo a Gatell, son unos irresponsables .😂","@jgnaredo Para mi que ya contrataron en todo el mundo a Gatell, son unos irresponsables .😂"
1551,"Mientras López y su caterva se jactaban d domar la pandemia, ver la 💡 al final del 🚇 y aplanar la curva, han muerto CIENTOS D MILES d mexicanos pero López-Gatell los reduce a ""una cantidad inusual"", prueba d la carencia d estrategia, d humanidad, d madre. #NosFaltan100mil","Mientras López y su caterva se jactaban d domar la pandemia, ver la 💡 al final del 🚇 y aplanar la curva, han muerto CIENTOS D MILES d mexicanos pero López-Gatell los reduce a ""una cantidad inusual"", prueba d la carencia d estrategia, d humanidad, d madre. #NosFaltan100mil"
1552,"@CiroGomezL @HLGatell Por supuesto Gatell es culpable !!! Era obvio q no ibas a wducar a millones para mañana. Debió haber tegias de control por zonas , cubrebocas obligatorio y hacerle caso a los que Si sabian","@CiroGomezL @HLGatell Por supuesto Gatell es culpable !!! Era obvio q no ibas a wducar a millones para mañana. Debió haber tegias de control por zonas , cubrebocas obligatorio y hacerle caso a los que Si sabian"
1553,"Es muy tarde para que el Presidente lo despida, (a Gatell ) pero aún es tiempo para que se allegue de expertos que le ayuden a modular la política contra el coronavirus, sin que un aventurero decida por él, por su gobierno y por el país. ⁦@rivapa⁩","Es muy tarde para que el Presidente lo despida, (a Gatell ) pero aún es tiempo para que se allegue de expertos que le ayuden a modular la política contra el coronavirus, sin que un aventurero decida por él, por su gobierno y por el país. ⁦@rivapa⁩"
1554,"@ElFinanciero_Mx @rivapa @HLGatell @SSalud_mx 1/2 Mas de 100,000 muertos. En México, por culpa de AMLO y el Dr. Muerte Gatell diario se infectan mas de 4500 personas, y cada día mueren mas de 500. Para ejemplo de un manejo correcto, Nueva Zelanda: lleva 25 muertos en toda la pandemia, el último falleció el 17 de septiembre","@ElFinanciero_Mx @rivapa @HLGatell @SSalud_mx 1/2 Mas de 100,000 muertos. En México, por culpa de AMLO y el Dr. Muerte Gatell diario se infectan mas de 4500 personas, y cada día mueren mas de 500. Para ejemplo de un manejo correcto, Nueva Zelanda: lleva 25 muertos en toda la pandemia, el último falleció el 17 de septiembre"
1555,Templo Mayor - 20 de Nov. - Vía @reforma ⁦@lopezobrador_⁩ ⁦@HLGatell⁩ “OFICIALMENTE en México ya hay un millón de contagiados y 100 mil personas muertas por el Covid-19. Para el subsecretario Hugo López-Gatell las cifras son intrascendentes” ,Templo Mayor - 20 de Nov. - Vía @reforma ⁦@lopezobrador_⁩ ⁦@HLGatell⁩ “OFICIALMENTE en México ya hay un millón de contagiados y 100 mil personas muertas por el Covid-19. Para el subsecretario Hugo López-Gatell las cifras son intrascendentes” 
1556,@SGC74620503 @ClaudioXGG Gatell es el cartucho que en su momento quemará AMLO y habrá tontos que se lo crean!,@SGC74620503 @ClaudioXGG Gatell es el cartucho que en su momento quemará AMLO y habrá tontos que se lo crean!
1557,"@rivapa @HLGatell Con su acostumbrado cinismo y soberbia López Gatell dijo ayer que era una cifra ""inusual"", y hoy el presidente para variar echando culpas a gobiernos anteriores y diciendo de manera increíble que Gatell ha hecho un trabajo extraordinario... que burla","@rivapa @HLGatell Con su acostumbrado cinismo y soberbia López Gatell dijo ayer que era una cifra ""inusual"", y hoy el presidente para variar echando culpas a gobiernos anteriores y diciendo de manera increíble que Gatell ha hecho un trabajo extraordinario... que burla"
1558,"México llega a 100 mil muertos por Covid, cifra ""inusual"", reconoce López-Gatell via El Universal ","México llega a 100 mil muertos por Covid, cifra ""inusual"", reconoce López-Gatell via El Universal "
1559,@dimitrov_sofia @HLGatell Terriblemente cierto tu hilo Linda Sofía ! Y lo más terrible que el IMBÉCIL de Gatell provocó ésta tragedia por ahorrarle unos pesos a su amo el KKS ! ,@dimitrov_sofia @HLGatell Terriblemente cierto tu hilo Linda Sofía ! Y lo más terrible que el IMBÉCIL de Gatell provocó ésta tragedia por ahorrarle unos pesos a su amo el KKS ! 
1560,"""Pruebas de la incompetencia de López-Gatell existen en abundancia.” Lean a @rivapa en EJE CENTRAL ","""Pruebas de la incompetencia de López-Gatell existen en abundancia.” Lean a @rivapa en EJE CENTRAL "
1561,@XoloElvis @lopezobrador_ Mientras no sea él la vida sigue y los demás... Pues los que murieron ya murieron cómo dijo Gatell,@XoloElvis @lopezobrador_ Mientras no sea él la vida sigue y los demás... Pues los que murieron ya murieron cómo dijo Gatell
1562,"OJO La cifra REAL de muertes por #covid en #México al día de hoy es de: ⚠️⚠️ 380,000 MUERTOS ⚠️⚠️ Analicen esa cifra, cada uno de esos muertos es una familia que hoy está sufriendo y la gran mayoría de esos muertos son culpa de los asesinos ineptos López Obrador y Gatell.","OJO La cifra REAL de muertes por #covid en #México al día de hoy es de: ⚠️⚠️ 380,000 MUERTOS ⚠️⚠️ Analicen esa cifra, cada uno de esos muertos es una familia que hoy está sufriendo y la gran mayoría de esos muertos son culpa de los asesinos ineptos López Obrador y Gatell."
1563,gatell bgttt idungg😭😭,gatell bgttt idungg😭😭
1564,"@arq_jafo @lopezobrador_ Cómo van a usar los fanáticos cubre bocas si sus guías espirituales no lo usan, cómo olvidar las palabras celebres de gatell que dijo ""en espacios abiertos no es necesario el cubre bocas"" y ahora culpa a medios de comunicación","@arq_jafo @lopezobrador_ Cómo van a usar los fanáticos cubre bocas si sus guías espirituales no lo usan, cómo olvidar las palabras celebres de gatell que dijo ""en espacios abiertos no es necesario el cubre bocas"" y ahora culpa a medios de comunicación"
1565,"@HernanGomezB @VivaAerobus @HLGatell Pues usted dirá lo que quiera. Pero López Gatell es un inepto títere, que sigue las órdenes del más inepto López, y si mucha culpa tienen los 2 López ineptos. Usted cuídese por favor 🤣😂 no se vaya a contagiar. ¡ridículo!","@HernanGomezB @VivaAerobus @HLGatell Pues usted dirá lo que quiera. Pero López Gatell es un inepto títere, que sigue las órdenes del más inepto López, y si mucha culpa tienen los 2 López ineptos. Usted cuídese por favor 🤣😂 no se vaya a contagiar. ¡ridículo!"
1566,"México llega a 100 mil muertos por COVID-19, cifra inusual: López Gatell ","México llega a 100 mil muertos por COVID-19, cifra inusual: López Gatell "
1567,"Dice AMLO que Gatell ha hecho un trabajo extraordinario durante la pandemia. Qué tal si no hubiera sido así? Ya no existiría el país. La minimizaron desde el principio, no promovieron el cubrebocas. Son unos cínicos.","Dice AMLO que Gatell ha hecho un trabajo extraordinario durante la pandemia. Qué tal si no hubiera sido así? Ya no existiría el país. La minimizaron desde el principio, no promovieron el cubrebocas. Son unos cínicos."
1568,"@MoneroKemchs @El_Universal_Mx @Univ_Opinion !!’ El loco Gatell y la muerte !!!! No hay para donde moverse , van por el mismo camino ☠️☠️☠️☠️☠️💀💀","@MoneroKemchs @El_Universal_Mx @Univ_Opinion !!’ El loco Gatell y la muerte !!!! No hay para donde moverse , van por el mismo camino ☠️☠️☠️☠️☠️💀💀"
1569,"""Cien mil muertos es una cifra inusual"". – Hugo López ""el inusual"" Gatell.","""Cien mil muertos es una cifra inusual"". – Hugo López ""el inusual"" Gatell."
1570,@panaclo Es la que llevo con Gatell a un don que tenía la cura del covid,@panaclo Es la que llevo con Gatell a un don que tenía la cura del covid
1571,"@AlfredoLecona Mas de 100,000 muertos. En México, por culpa de AMLO y el Dr. Muerte Gatell diario se infectan mas de 4500 personas, y cada día mueren mas de 500. Para ejemplo de un manejo correcto, Nueva Zelanda: lleva 25 muertos en toda la pandemia, el último falleció el 17 de septiembre","@AlfredoLecona Mas de 100,000 muertos. En México, por culpa de AMLO y el Dr. Muerte Gatell diario se infectan mas de 4500 personas, y cada día mueren mas de 500. Para ejemplo de un manejo correcto, Nueva Zelanda: lleva 25 muertos en toda la pandemia, el último falleció el 17 de septiembre"
1572,Así Gatell con #100Mil,Así Gatell con #100Mil
1573,"Y... En tu canal, tu amigo, @Javier_Alatorre en su noticiero no para de culpar al Dr. Lopez-Gatell de las defunciones y contagios, el chiste se cuenta solo, ustedes venden humo, son simuladores de la información.","Y... En tu canal, tu amigo, @Javier_Alatorre en su noticiero no para de culpar al Dr. Lopez-Gatell de las defunciones y contagios, el chiste se cuenta solo, ustedes venden humo, son simuladores de la información."
1574,"@qtf Pues si murio de Covid fue por Corrupta, por Fifi, por usar cubrebocas seguramente y sobre todo, por no comprar y portal un DETENTE, !!! Arma unica y poderosa para detener la pandemia ... #pobre mujer , murio por no seguir las recomendaciones de Gatell","@qtf Pues si murio de Covid fue por Corrupta, por Fifi, por usar cubrebocas seguramente y sobre todo, por no comprar y portal un DETENTE, !!! Arma unica y poderosa para detener la pandemia ... #pobre mujer , murio por no seguir las recomendaciones de Gatell"
1575,"@uescoto @ClaudioXGG Pero son los muertos de AMLO, y si quieres de Gatell que sólo es su títere!","@uescoto @ClaudioXGG Pero son los muertos de AMLO, y si quieres de Gatell que sólo es su títere!"
1576,"@rivapa @HLGatell Pero ayer el doctor cínicamente dijo que era una cifra ""inusual"" y el presidente hoy en su acostumbrada negación dijo que López Gatell a hecho un trabajo extraordinario... es una burla","@rivapa @HLGatell Pero ayer el doctor cínicamente dijo que era una cifra ""inusual"" y el presidente hoy en su acostumbrada negación dijo que López Gatell a hecho un trabajo extraordinario... es una burla"
1577,"@Joan_Gatell @joseparcastomas A quina pàgina del ""Manual de jove jerki"" ho diu això? Hauries de citar les fonts Gatell 😂😘","@Joan_Gatell @joseparcastomas A quina pàgina del ""Manual de jove jerki"" ho diu això? Hauries de citar les fonts Gatell 😂😘"
1578,@Enea_Salgado @SGarciaSoto Catástrofico cantinflas chimoltrufio GATELL .......dijo eso ? = CHALE,@Enea_Salgado @SGarciaSoto Catástrofico cantinflas chimoltrufio GATELL .......dijo eso ? = CHALE
1579,"La ""buena estrategia"" aplicada contra la pandemia de López Gatell ya nos llevó a rebasar las 100 mil muertes por coronavirus... Hasta cuándo reconoceran su fracaso.","La ""buena estrategia"" aplicada contra la pandemia de López Gatell ya nos llevó a rebasar las 100 mil muertes por coronavirus... Hasta cuándo reconoceran su fracaso."
1580,"@ElArlequin_Univ @El_Universal_Mx !!!!! No Son Malos Son Maletas , están muy verdes pa perico . La secretaria de salud . Sin salud del loco Gatell . La función pública ( fantasma , porque no existe ) de Sandoval que no investigan , ni sus bolsillos !!! Tienen mucha cola que les pisen , muchos pecados sin confesar","@ElArlequin_Univ @El_Universal_Mx !!!!! No Son Malos Son Maletas , están muy verdes pa perico . La secretaria de salud . Sin salud del loco Gatell . La función pública ( fantasma , porque no existe ) de Sandoval que no investigan , ni sus bolsillos !!! Tienen mucha cola que les pisen , muchos pecados sin confesar"
1581,"@wixoazulfc @lopezobrador_ Definitivamente algo anda mal contigo Fernando, no se respalda porque si, Gatell lleva mucho tiempo ofreciendo lo que podría salvarnos, pero la sociedad hipócrita falló.","@wixoazulfc @lopezobrador_ Definitivamente algo anda mal contigo Fernando, no se respalda porque si, Gatell lleva mucho tiempo ofreciendo lo que podría salvarnos, pero la sociedad hipócrita falló."
1582,@ElFinanciero_Mx @rivapa @HLGatell @SSalud_mx Lo bueno es que el Financiero y Don Ray son intrascendentes. Gracias a Gatell no hay tantos fallecidos.,@ElFinanciero_Mx @rivapa @HLGatell @SSalud_mx Lo bueno es que el Financiero y Don Ray son intrascendentes. Gracias a Gatell no hay tantos fallecidos.
1583,Más de 1 millón de contagios de #Covid19 en México: Llama López- Gatell a la persuasión para disminuir la movilidad de ciudadanos. ,Más de 1 millón de contagios de #Covid19 en México: Llama López- Gatell a la persuasión para disminuir la movilidad de ciudadanos. 
1584,Català 2 Castellà 3 🙃,Català 2 Castellà 3 🙃
1585,"Raymundo Riva Palacio Al Presidente le está contando una historia épica López-Gatell, q olvida el pronóstico d su consejero: el 4 d mayo iba a haber máximo 6 mil muertos; una semana después 30 mil, y como escenario “catastrófico”, 60 mil. Esta semana rebasamos los 100 mil muertos","Raymundo Riva Palacio Al Presidente le está contando una historia épica López-Gatell, q olvida el pronóstico d su consejero: el 4 d mayo iba a haber máximo 6 mil muertos; una semana después 30 mil, y como escenario “catastrófico”, 60 mil. Esta semana rebasamos los 100 mil muertos"
1586,"@PAPPY_F4U @CiroGomezL @HLGatell Parece que estos chayoteros como Ciro les alegrará, Me imagino si le dieran chayote, estaria hablando maravillas de Gatell diciendo es un virus mundial, lo está haciendo bien Porqueria de prensa, los mueve el maldito dinero","@PAPPY_F4U @CiroGomezL @HLGatell Parece que estos chayoteros como Ciro les alegrará, Me imagino si le dieran chayote, estaria hablando maravillas de Gatell diciendo es un virus mundial, lo está haciendo bien Porqueria de prensa, los mueve el maldito dinero"
1587,@RocioHe34360416 @lopezobrador_ Si!! Ya Barttlet en la carcel verdad?? Ah Elva Esther sigue pagando ? Ups no le regresaron lo robado y el inútil de Gatell lo ha hecho súper bien solo mas de 100 mil muertos #GobiernoDeLaMentira,@RocioHe34360416 @lopezobrador_ Si!! Ya Barttlet en la carcel verdad?? Ah Elva Esther sigue pagando ? Ups no le regresaron lo robado y el inútil de Gatell lo ha hecho súper bien solo mas de 100 mil muertos #GobiernoDeLaMentira
1588,"Por supuesto, López-Gatell es un extraordinario y excepcional pendejo.","Por supuesto, López-Gatell es un extraordinario y excepcional pendejo."
1589,"@rivapa @HLGatell El éxito o fracaso de las medidas implementadas por Gatell han ido dependiendo de «si y solo si...». Siempre lo dijo. Y cuando la gente no entiende que el «si y solo si» está en sus manos y no actúa en consecuencia, entonces cualquier proyección será un fracaso. Y así ha sido.","@rivapa @HLGatell El éxito o fracaso de las medidas implementadas por Gatell han ido dependiendo de «si y solo si...». Siempre lo dijo. Y cuando la gente no entiende que el «si y solo si» está en sus manos y no actúa en consecuencia, entonces cualquier proyección será un fracaso. Y así ha sido."
1590,"@joseparcastomas Si mes grans fortunes paguesin el que realment haurien de pagar, no nomes seria viable, sinó que tindriem molts mes recursos per invertir en altres serveis.","@joseparcastomas Si mes grans fortunes paguesin el que realment haurien de pagar, no nomes seria viable, sinó que tindriem molts mes recursos per invertir en altres serveis."
1591,"Si la prioridad hubiera sido, cuidar vidas y no camas... Pero Gatell solo sabe contar muertos y mal Para acabarla de chingar. ","Si la prioridad hubiera sido, cuidar vidas y no camas... Pero Gatell solo sabe contar muertos y mal Para acabarla de chingar. "
1592,"@dadkom14 Pinche Gatell, ¿por qué me hiciste tragon y gordo?","@dadkom14 Pinche Gatell, ¿por qué me hiciste tragon y gordo?"
1593,"“Medios han convertido las noticias de la pandemia en un mecanismo de confrontación”, acusó esta tarde el subsecretario López-Gatell ","“Medios han convertido las noticias de la pandemia en un mecanismo de confrontación”, acusó esta tarde el subsecretario López-Gatell "
1594,"@oftalmo20 Soy partidario de Gatell y Amlo y mi lógica siempre fue usar cubrebocas, ellos dan la pauta la decisión la tenemos cada uno, así que es un argumento pen...tonto.","@oftalmo20 Soy partidario de Gatell y Amlo y mi lógica siempre fue usar cubrebocas, ellos dan la pauta la decisión la tenemos cada uno, así que es un argumento pen...tonto."
1595,"@HernanGomezB @VivaAerobus @HLGatell La perrada seguirá yendose a la yugular de Gatell y de Amlo. No es gente de razones, solo quieren recuperar lo ya mamado y seguir mamando.","@HernanGomezB @VivaAerobus @HLGatell La perrada seguirá yendose a la yugular de Gatell y de Amlo. No es gente de razones, solo quieren recuperar lo ya mamado y seguir mamando."
1596,"@goliveros Por supuesto que sí. Minimizó la enfermedad, se burló del uso de cubrebocas, Lopez Gatell promovió la inmunidad de rebaño. Ahí están los resultados.","@goliveros Por supuesto que sí. Minimizó la enfermedad, se burló del uso de cubrebocas, Lopez Gatell promovió la inmunidad de rebaño. Ahí están los resultados."
1597,"Más de 100 mil decesos por el COVID, debido a las ocurrencias y negligencia de López y Gatell. Y la CNDH para cuando dará una postura o mínimo les llamará la atención, parece que se convirtió muda como una ""piedra""","Más de 100 mil decesos por el COVID, debido a las ocurrencias y negligencia de López y Gatell. Y la CNDH para cuando dará una postura o mínimo les llamará la atención, parece que se convirtió muda como una ""piedra"""
1598,"Todo es culpa de gobiernos pasados y los adversarios 😐 El secretario de Salud Jorge Alcocer y el subsecretario Hugo López-Gatell, han hecho ""un trabajo extraordinario"", dice el presidente. ","Todo es culpa de gobiernos pasados y los adversarios 😐 El secretario de Salud Jorge Alcocer y el subsecretario Hugo López-Gatell, han hecho ""un trabajo extraordinario"", dice el presidente. "
1599,@goliveros Si hubo una estrategia y al gobierno le funcionó y sigue funcionando. La estrategia tiene dos objetivos que sea barata y que las muertes sean poco a poco y fuera de hospitales. Sin duda alguna puedo decir que tanto como AMLO y Gatell pasarán a la historia como genocidas.,@goliveros Si hubo una estrategia y al gobierno le funcionó y sigue funcionando. La estrategia tiene dos objetivos que sea barata y que las muertes sean poco a poco y fuera de hospitales. Sin duda alguna puedo decir que tanto como AMLO y Gatell pasarán a la historia como genocidas.
1600,"El subsecretario López-Gatell pidió a los medios de comunicación no politizar la información sobre el COVID-19 en México, a quienes solicitó utilizar sus espacios para fomentar el uso del cubrebocas en la población ","El subsecretario López-Gatell pidió a los medios de comunicación no politizar la información sobre el COVID-19 en México, a quienes solicitó utilizar sus espacios para fomentar el uso del cubrebocas en la población "
1601,"@goliveros No. Por qué carajos tienen que culpar a el gobierno, y no es que lo defienda, a amlo, morena o Gatell, la irresponsabilidad es de la gente que no tiene una pizca de civilidad, que no es consciente, y que le juega al vivo con sus teorías conspirativas.. saludos Gonzalo","@goliveros No. Por qué carajos tienen que culpar a el gobierno, y no es que lo defienda, a amlo, morena o Gatell, la irresponsabilidad es de la gente que no tiene una pizca de civilidad, que no es consciente, y que le juega al vivo con sus teorías conspirativas.. saludos Gonzalo"
1602,@monicagarzag Hay que convencerlos dice Gatell.,@monicagarzag Hay que convencerlos dice Gatell.
1603,@JeSuisLaBOA @F_Alexis_DSAM Más Gatell #100MilDeGatell #LopezCorruptoInepto #LopezDestruyendoMexico #NiUnVotoAMORENA2021 #NiUnVotoAMORENA2021,@JeSuisLaBOA @F_Alexis_DSAM Más Gatell #100MilDeGatell #LopezCorruptoInepto #LopezDestruyendoMexico #NiUnVotoAMORENA2021 #NiUnVotoAMORENA2021
1604,"@El_Universal_Mx Imagínense el estadio azteca lleno!!!!!!, ahora pongan 13,000 personas sentadas en la cancha... ahora imagínenlos todos muertos..estos caen sobre Gatell y AMLO. No son solo un número ahora. Y extraoficialmente serían 3 estadios llenos, peor aún.","@El_Universal_Mx Imagínense el estadio azteca lleno!!!!!!, ahora pongan 13,000 personas sentadas en la cancha... ahora imagínenlos todos muertos..estos caen sobre Gatell y AMLO. No son solo un número ahora. Y extraoficialmente serían 3 estadios llenos, peor aún."
1605,"@rivapa @pmvm2015 @HLGatell Y si le hubieran atinado al pronóstico (porque eso fue ,una estimación)habría reconocido a López-Gatell???","@rivapa @pmvm2015 @HLGatell Y si le hubieran atinado al pronóstico (porque eso fue ,una estimación)habría reconocido a López-Gatell???"
1606,La pelea López-Gatell vs Irma Eréndira Sandoval ,La pelea López-Gatell vs Irma Eréndira Sandoval 
1607,"@LENGUADEFUEGO @rivapa @HLGatell Y tu haciendo lo que sabes hacer Riva palacios Chayoteros afectados culpando de un virus mundial a una persona que nos ha informado oportuna, clara y diariamente como cuidarnos Si te dieran chayote culparias a Dios y dirías que Gatell muy bien","@LENGUADEFUEGO @rivapa @HLGatell Y tu haciendo lo que sabes hacer Riva palacios Chayoteros afectados culpando de un virus mundial a una persona que nos ha informado oportuna, clara y diariamente como cuidarnos Si te dieran chayote culparias a Dios y dirías que Gatell muy bien"
1608,@ChumelTorres Maldito Gatell!,@ChumelTorres Maldito Gatell!
1609,"@FedericoArreola @maloguzmanvero Según Gatell “La inusual muerte de 100,000 mexicanos” hasta para eso son demasiado torpes","@FedericoArreola @maloguzmanvero Según Gatell “La inusual muerte de 100,000 mexicanos” hasta para eso son demasiado torpes"
1610,13. ( #SonMasDe100mil) En Mexico han muerto 100576 personas que confiaron en las recomendaciones de Gatell y en la fuerza del presidente. Se estima que las cifras verdaderas son más de 300000 y los enfermos más de 3 millones.,13. ( #SonMasDe100mil) En Mexico han muerto 100576 personas que confiaron en las recomendaciones de Gatell y en la fuerza del presidente. Se estima que las cifras verdaderas son más de 300000 y los enfermos más de 3 millones.
1611,@AreliPaz @beltrandelrio @lopezobrador_ Estas bien mal.... eres ignorante o lambiscona de gatell y peje.... son de los peores a nivel mundial,@AreliPaz @beltrandelrio @lopezobrador_ Estas bien mal.... eres ignorante o lambiscona de gatell y peje.... son de los peores a nivel mundial
1612,En las cifras de López-Gatell México rebasa las 100 mil defunciones por Coronavirus. ,En las cifras de López-Gatell México rebasa las 100 mil defunciones por Coronavirus. 
1613,(El Universal) Covid-19 mata a 100 mil 104; ocho estados presentan repunte. Lopez-Gatell dice que es cifra “inusual”. ,(El Universal) Covid-19 mata a 100 mil 104; ocho estados presentan repunte. Lopez-Gatell dice que es cifra “inusual”. 
1614,@Amadoelquelolea @HLGatell Que jijo es este gato Gatell.,@Amadoelquelolea @HLGatell Que jijo es este gato Gatell.
1615,"@lopezdoriga Imagínense el estadio azteca lleno!!!!!!, ahora pongan 13,000 personas sentadas en la cancha... ahora imagínenlos todos muertos..estos caen sobre Gatell y AMLO. No son solo un número ahora.","@lopezdoriga Imagínense el estadio azteca lleno!!!!!!, ahora pongan 13,000 personas sentadas en la cancha... ahora imagínenlos todos muertos..estos caen sobre Gatell y AMLO. No son solo un número ahora."
1616,"@RCANGELES @Claudiashein No, no se puede guardar la sana distancia ahí. El doctor Gatell siempre lo ha mencionado: se recomienda el uso de cubrebocas para mitigar el efecto de contagio en lugares donde sea imposible guardar la sana distancia.","@RCANGELES @Claudiashein No, no se puede guardar la sana distancia ahí. El doctor Gatell siempre lo ha mencionado: se recomienda el uso de cubrebocas para mitigar el efecto de contagio en lugares donde sea imposible guardar la sana distancia."
1617,¿Para qué escuchar las evasivas de López Gatell cuando tenemos testimonios nobles y equilibrados desde el campo de batalla?,¿Para qué escuchar las evasivas de López Gatell cuando tenemos testimonios nobles y equilibrados desde el campo de batalla?
