,tweet,parse
1026,"@GlodeJo07 2/3 Mas de 100,000 muertos. En México, por culpa de AMLO y el Dr. Muerte Gatell, diario se infectan mas de 4500 personas, y cada día mueren mas de 500. Para ejemplo de un manejo correcto, Nueva Zelanda: lleva 25 muertos en toda la pandemia, el último falleció el 17 de septiembre","@GlodeJo07 2/3 Mas de 100,000 muertos. En México, por culpa de AMLO y el Dr. Muerte Gatell, diario se infectan mas de 4500 personas, y cada día mueren mas de 500. Para ejemplo de un manejo correcto, Nueva Zelanda: lleva 25 muertos en toda la pandemia, el último falleció el 17 de septiembre"
1027,@AreliPaz @lopezobrador_ López Gatell anticipó que serian desastroso si hubieran 60 mil muertes. Luego vinieron maromas de padecimiento preexistentes para evadir su responsabilidad (SIEMPRE tiene que haber algún culpable ante su negligencia) Por último AMLO dice que ha hecho un trabajo excepcional.,@AreliPaz @lopezobrador_ López Gatell anticipó que serian desastroso si hubieran 60 mil muertes. Luego vinieron maromas de padecimiento preexistentes para evadir su responsabilidad (SIEMPRE tiene que haber algún culpable ante su negligencia) Por último AMLO dice que ha hecho un trabajo excepcional.
1028,@GlodeJo07 Ya no sorprende que la mierda de Lopez-Gatell diga tantas pende@j@das.,@GlodeJo07 Ya no sorprende que la mierda de Lopez-Gatell diga tantas pende@j@das.
1029,"@brisegonzalez05 Gatell siempre ha sido claro, siempre nos ha dicho que mantengamos distancia, no salir de casa, usar cubrebocas, el señor presidente y los mismos ciudadanos son los que no estan cumpliendo las reglas de sanidad de nuestra nueva normalidad","@brisegonzalez05 Gatell siempre ha sido claro, siempre nos ha dicho que mantengamos distancia, no salir de casa, usar cubrebocas, el señor presidente y los mismos ciudadanos son los que no estan cumpliendo las reglas de sanidad de nuestra nueva normalidad"
1030,"@SinLinea_Mx Cinismo en su máxima expresión, pero mientras tenga 30,000,000 de focas irracionales aplaudiendo, pues así seguirá, sus palabras y el amor desmedido de los Chairos hacen que gatell se sienta, Artista y candidato presidencial, y es caricatura de científico, el ""médico asesino""","@SinLinea_Mx Cinismo en su máxima expresión, pero mientras tenga 30,000,000 de focas irracionales aplaudiendo, pues así seguirá, sus palabras y el amor desmedido de los Chairos hacen que gatell se sienta, Artista y candidato presidencial, y es caricatura de científico, el ""médico asesino"""
1031,@davenaruto Eres pendejo verdad? Si si ahuevo ahuevo culpemos a gatell y no a la gente pendeja que sale y nunca se cuido en la Cuarentena,@davenaruto Eres pendejo verdad? Si si ahuevo ahuevo culpemos a gatell y no a la gente pendeja que sale y nunca se cuido en la Cuarentena
1032,😷📣Calderón cuestiona cifra de muertos por COVID-19 de López-Gatell - ,😷📣Calderón cuestiona cifra de muertos por COVID-19 de López-Gatell - 
1033,@oscarmartinezt @CoparmexNL @GobiernoMX @HLGatell @SSalud_mx Bueno ahora dime a nivel mundial... España Francia Inglaterra Italia Austria...algunos de ellos ya van con la tercera oleada incluso ya implementaron toque de queda...ahí de quién es la culpa de ese gobierno o es que México y gatell influyeron o la gente pendeja como usted.,@oscarmartinezt @CoparmexNL @GobiernoMX @HLGatell @SSalud_mx Bueno ahora dime a nivel mundial... España Francia Inglaterra Italia Austria...algunos de ellos ya van con la tercera oleada incluso ya implementaron toque de queda...ahí de quién es la culpa de ese gobierno o es que México y gatell influyeron o la gente pendeja como usted.
1034,"@literalmexico @lopezobrador_ López Obrador el peor presidente que ha tenido México, todavía se atreve el muy infeliz a decir que López Gatell ha hecho un buen trabajo. Mentiroso, incapaz, inculto, de ideas viejas pero sobre todo es un COBARDE","@literalmexico @lopezobrador_ López Obrador el peor presidente que ha tenido México, todavía se atreve el muy infeliz a decir que López Gatell ha hecho un buen trabajo. Mentiroso, incapaz, inculto, de ideas viejas pero sobre todo es un COBARDE"
1035,"Es curioso ver como le echan la culpa a Lopez Gatell por la cantidad de muertes por COVID-19 en México, seguramente el subsecretario anda incitando que se aglomeren las personas y no sigan las medidas establecidas. La culpa es de quien sale cuando no es esencial.","Es curioso ver como le echan la culpa a Lopez Gatell por la cantidad de muertes por COVID-19 en México, seguramente el subsecretario anda incitando que se aglomeren las personas y no sigan las medidas establecidas. La culpa es de quien sale cuando no es esencial."
1036,"@AreliPaz @lopezobrador_ Extraordinario??? Estamos muy por encima, para mal, que los otros países del mundo! López Gatell Dr. muerte! ","@AreliPaz @lopezobrador_ Extraordinario??? Estamos muy por encima, para mal, que los otros países del mundo! López Gatell Dr. muerte! "
1037,"@PoetaCaminate @ramblassino Todo cierto, excepto que no tienes CovIdiotas haciendo fiestas clandestinas, que al enfermar 15 dias despues culpan al gobierno. Es decir los Japoneses si hacen todo lo que ha dicho hasta el cansancio el Dr Gatell, Sana distancia, aislamiento en caso de sintomas y etc.","@PoetaCaminate @ramblassino Todo cierto, excepto que no tienes CovIdiotas haciendo fiestas clandestinas, que al enfermar 15 dias despues culpan al gobierno. Es decir los Japoneses si hacen todo lo que ha dicho hasta el cansancio el Dr Gatell, Sana distancia, aislamiento en caso de sintomas y etc."
1038,Cifra de 100 mil muertes por Covid-19 es “inusual”: López-Gatell ,Cifra de 100 mil muertes por Covid-19 es “inusual”: López-Gatell 
1039,"Al principio gatell le dijo que era necesario poner restricciones para que el número de contagiados fuese mínimo, luego apoyó a su presidente. gatell lo dijo claro me: no hay pruebas de que los cubrebocas sirvan para aminorar los contagios, usar el contagio de rebaño","Al principio gatell le dijo que era necesario poner restricciones para que el número de contagiados fuese mínimo, luego apoyó a su presidente. gatell lo dijo claro me: no hay pruebas de que los cubrebocas sirvan para aminorar los contagios, usar el contagio de rebaño"
1040,Eres un p3nd3jo Gatell.,Eres un p3nd3jo Gatell.
1041,"@Rod_CuentemeMas Si, muuuuy confusos para sectores vulnerables. Acuérdate cuando en mayo dijo que se domó la pandemia, que de abeazarse no pasa nada, los detentes, que Gatell dijo que AMLO es una fuerza moral y no de contagio, la no rifa para atender salud... Etc.","@Rod_CuentemeMas Si, muuuuy confusos para sectores vulnerables. Acuérdate cuando en mayo dijo que se domó la pandemia, que de abeazarse no pasa nada, los detentes, que Gatell dijo que AMLO es una fuerza moral y no de contagio, la no rifa para atender salud... Etc."
1042,"No entiendo cómo es que culpamma #Gatell por las  el único que se tomó la Pandemia en serio, nos dijo que teníamos que hacer y advirtió que no había capacidad hospitalaria para atender a tanta población.a todo mundo le valió madre. Los dueños","No entiendo cómo es que culpamma #Gatell por las  el único que se tomó la Pandemia en serio, nos dijo que teníamos que hacer y advirtió que no había capacidad hospitalaria para atender a tanta población.a todo mundo le valió madre. Los dueños"
1043,La pelea López-Gatell vs Irma Eréndira Sandoval ,La pelea López-Gatell vs Irma Eréndira Sandoval 
1044,"@EmmaChoquita La gente que culpa a López Gatell,no da ha dado cuenta de que en México,se ha dado información transparente acerca de la pandemia,tal vez estarían contentos si se les mintiera como se hacía anteriormente,les gusta que les mientan...yo apoyo a López Gatell...","@EmmaChoquita La gente que culpa a López Gatell,no da ha dado cuenta de que en México,se ha dado información transparente acerca de la pandemia,tal vez estarían contentos si se les mintiera como se hacía anteriormente,les gusta que les mientan...yo apoyo a López Gatell..."
1045,@GlodeJo07 El colmo del cinismo es decir que López-Gatell ha hecho trabajo alguno...,@GlodeJo07 El colmo del cinismo es decir que López-Gatell ha hecho trabajo alguno...
1046,"Pregúntele a Ricardo Anaya, Yuridia Sierra, el gabinete de obrador, a los miembros del Senado. ¿Cómo se contagiaron?, Obviamente se contagiaron por su propia imprudencia, muchos llevamos desde que inició la pandemia, las sugerencias de López Gatell y miren, sanos.","Pregúntele a Ricardo Anaya, Yuridia Sierra, el gabinete de obrador, a los miembros del Senado. ¿Cómo se contagiaron?, Obviamente se contagiaron por su propia imprudencia, muchos llevamos desde que inició la pandemia, las sugerencias de López Gatell y miren, sanos."
1047,"@POLOCUERVO @DrawingsFanny @Patrici99636952 @OficialFrenaaa @gilbertolozanog @PedroFerriz @tumbaburross @FranRicoToro No es culpa de gatell, es de López y gatel","@POLOCUERVO @DrawingsFanny @Patrici99636952 @OficialFrenaaa @gilbertolozanog @PedroFerriz @tumbaburross @FranRicoToro No es culpa de gatell, es de López y gatel"
1048,@ReginadelC 100k y sigo esperando la renuncia de gatell,@ReginadelC 100k y sigo esperando la renuncia de gatell
1049,"Ya ni me acuerdo, ¿quién quedamos que era Hugo López Gatell?","Ya ni me acuerdo, ¿quién quedamos que era Hugo López Gatell?"
1050,"@lopezdoriga A pesar de los avances de la ciencia por siglos en muchos campos del conocimiento no se ha podido saber cuáles son los límites de la estupidez humana, y ese Gatell es un claro ejemplo.","@lopezdoriga A pesar de los avances de la ciencia por siglos en muchos campos del conocimiento no se ha podido saber cuáles son los límites de la estupidez humana, y ese Gatell es un claro ejemplo."
1051,"@m_ebrard 100 mil, no lo festejarán, gracias a la maravillosa y excelente forma de manejar la pandemia del asesino gatell y su proxeneta manuel","@m_ebrard 100 mil, no lo festejarán, gracias a la maravillosa y excelente forma de manejar la pandemia del asesino gatell y su proxeneta manuel"
1052,AMLO habla de beisbol mientras López-Gatell anuncia 100 mil muertos ,AMLO habla de beisbol mientras López-Gatell anuncia 100 mil muertos 
1053,La verdadera tragedia en el país es tener a López Gatell como encargado de la pandemia 👇,La verdadera tragedia en el país es tener a López Gatell como encargado de la pandemia 👇
1054,"Tal como ocurrió con el Terremoto de 1985, lo más triste de de esto, es que jamás sabremos, ni por aproximación, cual fue la cifra real de víctimas de la Pandemia #COVID19 en México. Finalmente, más allá de Gatell, nos gobiernan los mismos fracasados de antes. #NosFaltanCienMil ","Tal como ocurrió con el Terremoto de 1985, lo más triste de de esto, es que jamás sabremos, ni por aproximación, cual fue la cifra real de víctimas de la Pandemia #COVID19 en México. Finalmente, más allá de Gatell, nos gobiernan los mismos fracasados de antes. #NosFaltanCienMil "
1055,"Gatell, Doctor muerte, solo queremos tu renuncia, por dignidad científica #NosFaltan100mil ","Gatell, Doctor muerte, solo queremos tu renuncia, por dignidad científica #NosFaltan100mil "
1056,"@gabrielguerrac @DeniseDresserG Esto no pasa desapercibido, que renuncie Gatell !!","@gabrielguerrac @DeniseDresserG Esto no pasa desapercibido, que renuncie Gatell !!"
1057,El colmo del cinismo es decir que López-Gatell ha hecho un trabajo excepcional con la pandemia...,El colmo del cinismo es decir que López-Gatell ha hecho un trabajo excepcional con la pandemia...
1058,"@jaime_arau @Pajaropolitico Una cosa es lo que te dice Gatell (100mil) la otra es la taza de mortalidad de lo que va del año. La cantidad de actas de defunción comparada con las del año pasado, muestra un incremento mayor a los 200mil.","@jaime_arau @Pajaropolitico Una cosa es lo que te dice Gatell (100mil) la otra es la taza de mortalidad de lo que va del año. La cantidad de actas de defunción comparada con las del año pasado, muestra un incremento mayor a los 200mil."
1059,@lamullerdelbar Y porque el señor gatell es culpable de que nose cuidaran de que no usaran cubrebocas fueran a reuniones familiares mio estan en esos 100mil y no ando culpando al gobierno,@lamullerdelbar Y porque el señor gatell es culpable de que nose cuidaran de que no usaran cubrebocas fueran a reuniones familiares mio estan en esos 100mil y no ando culpando al gobierno
1060,"@pabloj01 @FoWorLesS @Misa_Medina_H @HLGatell En lo que Gatell tiene razón, pero ya lo dijo muy tarde, es que no se debe pensar que con el cubre bocas uno se vuelve inmune, pues se corre el riesgo de que la gente decida salir a cualquier lugar sólo porque trae cubrebocas.","@pabloj01 @FoWorLesS @Misa_Medina_H @HLGatell En lo que Gatell tiene razón, pero ya lo dijo muy tarde, es que no se debe pensar que con el cubre bocas uno se vuelve inmune, pues se corre el riesgo de que la gente decida salir a cualquier lugar sólo porque trae cubrebocas."
1061,@deniseramosm @concursomemes @Garcimonero @pao_maldo @HatsumiNonaka No es de #Gatell pero da un chingo de risa 😂 ,@deniseramosm @concursomemes @Garcimonero @pao_maldo @HatsumiNonaka No es de #Gatell pero da un chingo de risa 😂 
1062,"#Gatell100k #DrMuerte #Gatell @HLGatell 100,000 muertos oficiales y usted necio con su política fallida y ridícula. Desde marzo se lo advertimos. Desde marzo sabíamos que sus decisiones desembocarían en esta masacre. Hoy, su ineptitud hizo de México un panteón. ","#Gatell100k #DrMuerte #Gatell @HLGatell 100,000 muertos oficiales y usted necio con su política fallida y ridícula. Desde marzo se lo advertimos. Desde marzo sabíamos que sus decisiones desembocarían en esta masacre. Hoy, su ineptitud hizo de México un panteón. "
1063,"@brisegonzalez05 Ahuevo, porque Gatell tiene la culpa de que la gente no se cuide, asies","@brisegonzalez05 Ahuevo, porque Gatell tiene la culpa de que la gente no se cuide, asies"
1064,@YuririaSierra “Inusual” Según el gato genocida Gatell.,@YuririaSierra “Inusual” Según el gato genocida Gatell.
1065,"@araceli03956935 @HLGatell Yo no conozco ninguna estrategia de Gatell , su actividad la hace al hay se va , eso a causado muchos muertos , en manos de quien estamos los mexicanos ?","@araceli03956935 @HLGatell Yo no conozco ninguna estrategia de Gatell , su actividad la hace al hay se va , eso a causado muchos muertos , en manos de quien estamos los mexicanos ?"
1066,@alvaro_delgado @urgecambiaramex @El_Universal_Mx Esta pandemia asta que no salga la vacuna se podrá detener y es miserable hacer responsable a Gatell creo que ya estamos muy maduros para saber q si no nos cuidamos estamos en peligro de muerte .está cabron ponerle un policía a cada ciudadano para que nos este cuidando no mames,@alvaro_delgado @urgecambiaramex @El_Universal_Mx Esta pandemia asta que no salga la vacuna se podrá detener y es miserable hacer responsable a Gatell creo que ya estamos muy maduros para saber q si no nos cuidamos estamos en peligro de muerte .está cabron ponerle un policía a cada ciudadano para que nos este cuidando no mames
1067,"@rivapa @JLozanoA @HLGatell Una felicitación, al dr Hugo López Gatell, profesional, en todos los sentidos, su capacidad, y su sensibilidad, ha promovido, que este mal mundial, no afecte a México, gracias por proteger, por instruir, y por guiar, a los mexicanos, los 100,000 muertos, son ganas de chingar.","@rivapa @JLozanoA @HLGatell Una felicitación, al dr Hugo López Gatell, profesional, en todos los sentidos, su capacidad, y su sensibilidad, ha promovido, que este mal mundial, no afecte a México, gracias por proteger, por instruir, y por guiar, a los mexicanos, los 100,000 muertos, son ganas de chingar."
1068,@gabrielguerrac Deberia de quejarse del nulo esfuerzo de autoridades locales y estatales que sin duda tienen una gran responsabilidad y solo culpan a gatell de su gran ineficiencia al aplicar medidas sanitarias.,@gabrielguerrac Deberia de quejarse del nulo esfuerzo de autoridades locales y estatales que sin duda tienen una gran responsabilidad y solo culpan a gatell de su gran ineficiencia al aplicar medidas sanitarias.
1069,"En las conferencias de Hugo López-Gatell, una de las palabras fetiche es “meseta”, ese camino plano que dibuja la curva pandémica lejos de los picos, mientras algunos Estados entran de nuevo en fases de máximo riesgo 100.000 muertos en México ","En las conferencias de Hugo López-Gatell, una de las palabras fetiche es “meseta”, ese camino plano que dibuja la curva pandémica lejos de los picos, mientras algunos Estados entran de nuevo en fases de máximo riesgo 100.000 muertos en México "
1070,"@qtf Y no crea que estoy de acuerdo con Gatell, se ha equivocado también pero, echarle la culpa solo a él y no a la gente irresponsable?? Usted a lo mejor no miente pero, si omite buena parte de la verdad y resulta ser igual que mentir. Que lástima por usted. En fin... Es lo que hay","@qtf Y no crea que estoy de acuerdo con Gatell, se ha equivocado también pero, echarle la culpa solo a él y no a la gente irresponsable?? Usted a lo mejor no miente pero, si omite buena parte de la verdad y resulta ser igual que mentir. Que lástima por usted. En fin... Es lo que hay"
1071,"@HernanGomezB @VivaAerobus @HLGatell Ok pinche ESTÚPIDO, ahora ve al metro de la cdmx a cualquier hora y nos reportas, va!!! Y para HDP solo está gatell","@HernanGomezB @VivaAerobus @HLGatell Ok pinche ESTÚPIDO, ahora ve al metro de la cdmx a cualquier hora y nos reportas, va!!! Y para HDP solo está gatell"
1072,"@EmmaChoquita pos también, Gatell es un verdadero chingón","@EmmaChoquita pos también, Gatell es un verdadero chingón"
1073,"@pabloj01 @FoWorLesS @Misa_Medina_H @HLGatell No es verdad, el cubre bocas sirve y es independiente del resto de las cosas. Todo aporta. Lo que Gatell intentó fue desviar la atención de que habían vendido todos los cubrebocas a China y no teníamos, por eso trató de desacreditarlo y prolongó mucho su mentira.","@pabloj01 @FoWorLesS @Misa_Medina_H @HLGatell No es verdad, el cubre bocas sirve y es independiente del resto de las cosas. Todo aporta. Lo que Gatell intentó fue desviar la atención de que habían vendido todos los cubrebocas a China y no teníamos, por eso trató de desacreditarlo y prolongó mucho su mentira."
1074,"@JLozanoA @elsolde_mexico @diario24horas No tiene mucho esto señor , salir a la calle sin las medidas de seguro varios se contagiaron ahí , ejemplo mis vecinos murieron 3 hermanos , por no cuidarse y me va a decir que esto es culpa del gobierno?? No recuerdo a Gatell diciendo vayan a marchar en medio de una pandemia ","@JLozanoA @elsolde_mexico @diario24horas No tiene mucho esto señor , salir a la calle sin las medidas de seguro varios se contagiaron ahí , ejemplo mis vecinos murieron 3 hermanos , por no cuidarse y me va a decir que esto es culpa del gobierno?? No recuerdo a Gatell diciendo vayan a marchar en medio de una pandemia "
1075,Suscribo yo apoyo a López Gatell,Suscribo yo apoyo a López Gatell
1076,"@panaclo @Tijolin20 Lo que se necesita es capacidad y buen manejo de la pandemia y con el Dr Gatell se comprueba que con salir a “informar” diariamente, no se es eficaz","@panaclo @Tijolin20 Lo que se necesita es capacidad y buen manejo de la pandemia y con el Dr Gatell se comprueba que con salir a “informar” diariamente, no se es eficaz"
1077,"López-Gatell, alertó que en la epidemia Covid ”todavía nos depara un momento de mayor intensidad que será diciembre, enero, y quizá una parte de febrero”. ","López-Gatell, alertó que en la epidemia Covid ”todavía nos depara un momento de mayor intensidad que será diciembre, enero, y quizá una parte de febrero”. "
1078,Puro Pendejo culpa a #Gatell por las 100 mil muertes,Puro Pendejo culpa a #Gatell por las 100 mil muertes
1079,"@araceli03956935 @HLGatell Nunca tuvieron estrategia, ni la tienen ahora , nunca vi a Gatell en un hospital , ni en giras por la Republica checando necesidades y enfermos en hospitales , solo lo vi en la tele dando cifras y aplaudiendo a el presidente !","@araceli03956935 @HLGatell Nunca tuvieron estrategia, ni la tienen ahora , nunca vi a Gatell en un hospital , ni en giras por la Republica checando necesidades y enfermos en hospitales , solo lo vi en la tele dando cifras y aplaudiendo a el presidente !"
1080,"Culpan a Gatell por los muertos como si él los hubiese matado, cuando fue la gente irresponsable. Pero bueno así es México (Sorbito de Café)","Culpan a Gatell por los muertos como si él los hubiese matado, cuando fue la gente irresponsable. Pero bueno así es México (Sorbito de Café)"
1081,"En cualquier sitio facilmente hay 7 de cada 10 personas sin cubrebocas o mal puesto, pero les es más fácil echarle la culpa a López-Gatell","En cualquier sitio facilmente hay 7 de cada 10 personas sin cubrebocas o mal puesto, pero les es más fácil echarle la culpa a López-Gatell"
1082,"@goliveros Porque culpar al gobierno caray, te recuerdo que el comunicador de nombre Javier Alatorre, le digo a la ciudadanía, no hacer caso a las recomendaciones del Dr. Lopez Gatell, y no veo que lo culpes a él por nada, es más, nisiquiera opinaste del tema.","@goliveros Porque culpar al gobierno caray, te recuerdo que el comunicador de nombre Javier Alatorre, le digo a la ciudadanía, no hacer caso a las recomendaciones del Dr. Lopez Gatell, y no veo que lo culpes a él por nada, es más, nisiquiera opinaste del tema."
1083,"¿Por qué chingados responsabilizan a Gatell de las 100,000 muertes? No mamen, cada quien es responsable de sus actos y de las decisiones tomadas. Bien que andan con el cubrebocas abajo de la nariz, y de peda! Tantita madre! 🤬","¿Por qué chingados responsabilizan a Gatell de las 100,000 muertes? No mamen, cada quien es responsable de sus actos y de las decisiones tomadas. Bien que andan con el cubrebocas abajo de la nariz, y de peda! Tantita madre! 🤬"
1084,"“Lopez Gatell ha hecho un trabajo extraordinario, excepcional”: AMLO 20 de noviembre de 2020 La realidad 👇👇👇 ","“Lopez Gatell ha hecho un trabajo extraordinario, excepcional”: AMLO 20 de noviembre de 2020 La realidad 👇👇👇 "
1085,"#RevoluciónMexicana #SoyRevolucionario Gatell dijo que un escenario trágico serían 60mil muertos, hoy en México superamos 100mil muertos oficialmente; y datos no oficiales, se contabilizan + de 300mil muertos. Y mientras tanto, López sin usar cubrebocas y dando abrazos.. 🖕🏾🖕🏼🇲🇽","#RevoluciónMexicana #SoyRevolucionario Gatell dijo que un escenario trágico serían 60mil muertos, hoy en México superamos 100mil muertos oficialmente; y datos no oficiales, se contabilizan + de 300mil muertos. Y mientras tanto, López sin usar cubrebocas y dando abrazos.. 🖕🏾🖕🏼🇲🇽"
1086,López-Gatell ve oportunidad para cannabis en algunos usos terapéuticos ,López-Gatell ve oportunidad para cannabis en algunos usos terapéuticos 
1087,"@AlejanndraG @HLGatell ¿No se preveía? O sea.... a los mexicanos de 2a se los va a llevar la chingada, pero no serán muchos (de Gatell a Lopez)","@AlejanndraG @HLGatell ¿No se preveía? O sea.... a los mexicanos de 2a se los va a llevar la chingada, pero no serán muchos (de Gatell a Lopez)"
1088,"No habrá cambios en política del gobierno en pandemia, AMLO al rebasar las 100 mil muertes ""Lo que se ha hecho es lo que consideramos ha dado resultados, Gatell hace un trabajo extraordinario"": @lopezobrador_ ","No habrá cambios en política del gobierno en pandemia, AMLO al rebasar las 100 mil muertes ""Lo que se ha hecho es lo que consideramos ha dado resultados, Gatell hace un trabajo extraordinario"": @lopezobrador_ "
1089,La minoría que hace ruido en redes sociales habla del Dr Gatell como si todo lo que pasa por el #Covid_19mx dependiera de él,La minoría que hace ruido en redes sociales habla del Dr Gatell como si todo lo que pasa por el #Covid_19mx dependiera de él
1090,@riveron72 A Gatell hay que acabarlo 100 000 veces si no se puede de otra firma al menos a mentadas Que lo corran ya!,@riveron72 A Gatell hay que acabarlo 100 000 veces si no se puede de otra firma al menos a mentadas Que lo corran ya!
1091,"@qtf Qué fácil, Fernanda, culpar a Gatell y no criticar al resto de gente que sigue saliendo a fiestas, antros, playas, marchas feministas, de oposición y los de apoyo. Que mal es solo criticar a una parte y no al grueso del problema. La creí una mujer inteligente, veo que no lo es.","@qtf Qué fácil, Fernanda, culpar a Gatell y no criticar al resto de gente que sigue saliendo a fiestas, antros, playas, marchas feministas, de oposición y los de apoyo. Que mal es solo criticar a una parte y no al grueso del problema. La creí una mujer inteligente, veo que no lo es."
1092,"@jenarovillamil @lopezobrador_ Lo correcto. Es un inútil y asesino. Él y su compinche López Gatell. Sus conceptos del no pasa nada, abrazos, el cubrebocas no sirve, si llegamos a 60,000 es una catástrofe, el escudo moral, el detente, etc....","@jenarovillamil @lopezobrador_ Lo correcto. Es un inútil y asesino. Él y su compinche López Gatell. Sus conceptos del no pasa nada, abrazos, el cubrebocas no sirve, si llegamos a 60,000 es una catástrofe, el escudo moral, el detente, etc...."
1093,@AreliPaz @lopezobrador_ Es que ya es demasiado tarde........ Ahorita nadie en el gabinete tomaría las riendas de esta contingencia..... Y como Gatell es imprescindible para López...... En su momento ya se tomarán las acciones para esta lacra llamada Gatell,@AreliPaz @lopezobrador_ Es que ya es demasiado tarde........ Ahorita nadie en el gabinete tomaría las riendas de esta contingencia..... Y como Gatell es imprescindible para López...... En su momento ya se tomarán las acciones para esta lacra llamada Gatell
